{
  "canonical_delivery_id": "bears-governance-kernel-v1",
  "changelog_gate": {
    "delivery_id_required": "bears-governance-kernel-v1",
    "owner_issue": "#384",
    "required_metadata_value": "release-note-gate:#384",
    "status": "linked"
  },
  "commands": [
    "validate",
    "check-message --commit <ref> --json",
    "validate-runtime --commit <sha> --json",
    "emit-summary --commit <sha> --from-git <range> --json"
  ],
  "component_issue": "#391",
  "doctor_integration": {
    "check_id": "commit_closeout",
    "delivery_id_field": "delivery_id",
    "runtime_sha_authority": "runtime/local-commit-validation/<commit_sha>.json",
    "summary_field": "closeout_summary"
  },
  "final_report_policy": "Final user replies may stay short after bears_doctor emits closeout_summary with delivery_id, exact SHA, validation, debt, cleanup, changelog linkage, and evidence paths.",
  "forbidden_output_markers": [
    "BEGIN PRIVATE KEY",
    "raw_secret",
    ".env=",
    "credential=",
    "raw log",
    "raw chat",
    "raw vpn config",
    "production data"
  ],
  "owner_role": "bears-machine-first-execution-kernel-engineer",
  "required_metadata": [
    "Issue",
    "Delivery-Id",
    "Scope",
    "Affected-Range",
    "Evidence",
    "Changelog",
    "Blockers"
  ],
  "runtime_evidence_templates": [
    "runtime/local-commit-validation/<commit_sha>.json",
    "runtime/bears-doctor/<commit_sha>.closeout.json"
  ],
  "schema": "bears-commit-closeout.v1",
  "updated": "2026-06-24",
  "version": "1"
}
